,id,conversation_id,created_at,date,timezone,place,tweet,language,hashtags,cashtags,user_id,user_id_str,username,name,day,hour,link,urls,photos,video,thumbnail,retweet,nlikes,nreplies,nretweets,quote_url,search,near,geo,source,user_rt_id,user_rt,retweet_id,reply_to,retweet_date,translate,trans_src,trans_dest
706,1346969751952773120,1346967381180968965,1609977589000.0,2021-01-06 23:59:49,+0100,,@kenolin1 Trump is trashing our country and I'm not going to stand by and watch. We have been the silent majority who voted for Biden because we see our democracy being dangerously threatened. It's time to make some noise: start calling and emailing elected officials and don't give up.,en,[],[],1144026751393292288,1144026751393292288,LibbyLivingst15,NJLibby,3,23,https://twitter.com/LibbyLivingst15/status/1346969751952773120,[],[],0,,False,14,0,2,,Trump,,,,,,,"[{'screen_name': 'kenolin1', 'name': 'ken olin', 'id': '164679813'}]",,,,
707,1346969751923396608,1346969751923396608,1609977589000.0,2021-01-06 23:59:49,+0100,,Egentlig ikke så veldig overraskende.President Trump har demonstrert sin fascistiske sanne natur siden før han ble valgt i 2016.Og de seneste ukene har han svartnet helt.Alle har kunnet se det.  https://t.co/ajpwyeWB1i,no,[],[],396618124,396618124,StenRHelland,Sten R.Helland,3,23,https://twitter.com/StenRHelland/status/1346969751923396608,['https://www.dagsavisen.no/debatt/kommentar/uvirkelighetens-washington-1.1820019'],[],0,,False,0,0,0,,Trump,,,,,,,[],,,,
708,1346969751915032576,1346969751915032576,1609977589000.0,2021-01-06 23:59:49,+0100,,At our capital no less??? The Senate Sergeant at Arms has the authority to arrest Trump. I believe the House Sergeant at Arms does as well. Trump is inciting  a coup!!! This is treasonous.  #,en,[],[],184844754,184844754,David_call,J.David Call,3,23,https://twitter.com/David_call/status/1346969751915032576,[],[],0,,False,0,0,0,,Trump,,,,,,,[],,,,
709,1346969751906512896,1346969751906512896,1609977588000.0,2021-01-06 23:59:48,+0100,,"I’m just glad Trump supporters didn’t do something so overly violent, like kneeling at a football game.",en,[],[],1080188052365029376,1080188052365029376,acnewsitics,Alex Cole,3,23,https://twitter.com/acnewsitics/status/1346969751906512896,[],[],0,,False,18217,171,3499,,Trump,,,,,,,[],,,,
710,1346969751885549571,1346969634558234627,1609977588000.0,2021-01-06 23:59:48,+0100,,@ItsxRihanna Trump supporters are holding a protest of election results and attacking place and states.,en,[],[],1258868414610726912,1258868414610726912,pasteIIias,🍭,3,23,https://twitter.com/pasteIIias/status/1346969751885549571,[],[],0,,False,1,0,0,,Trump,,,,,,,"[{'screen_name': 'ItsxRihanna', 'name': 'inactive *sorry if i dont reply to dms*', 'id': '1297009508607307776'}]",,,,
711,1346969751818432513,1346969751818432513,1609977588000.0,2021-01-06 23:59:48,+0100,,Wow Trump said antifa was the terrorist black lives matter were terrorist but it turns out it's the red hat trumpsters that are the terrorist they should have been arrested and tried as terrorists but instead were let go,en,[],[],285040610,285040610,papaone1,Big papa Mike,3,23,https://twitter.com/papaone1/status/1346969751818432513,[],[],0,,False,0,0,0,https://twitter.com/washingtonpost/status/1346960937920700420,Trump,,,,,,,[],,,,
712,1346969751755632644,1346904238148911107,1609977588000.0,2021-01-06 23:59:48,+0100,,@hppyjesusfreak I'm a little confused why would he knowingly dress this way to pretend to be a trump supporter,en,[],[],1339261736713658370,1339261736713658370,TheAlphaRaze,Alpha Raze,3,23,https://twitter.com/TheAlphaRaze/status/1346969751755632644,[],[],0,,False,0,0,0,,Trump,,,,,,,"[{'screen_name': 'hppyjesusfreak', 'name': '🇺🇸KrakenArtsFarm🇺🇸', 'id': '37862226'}]",,,,
713,1346969751705296897,1346969751705296897,1609977588000.0,2021-01-06 23:59:48,+0100,,Trump has to be one of the worst presidents in America,en,[],[],1081945668485373953,1081945668485373953,Victoriadela99,Victoria,3,23,https://twitter.com/Victoriadela99/status/1346969751705296897,[],[],0,,False,1,0,0,,Trump,,,,,,,[],,,,
714,1346969751285886978,1346969751285886978,1609977588000.0,2021-01-06 23:59:48,+0100,,"La pseudo puissance mondiale, n'avait pas de masques, à géré les confinements en mode bricolage et pour finir pas de vaccins La pseudo démocratie américaine montre son vrai visage  #Macron #COVID19 #vaccingate #confinement #veran #castex #COVID19 #gouvernement #Trump #usacapitol  https://t.co/pc6FM7w4SO",fr,"['macron', 'covid19', 'vaccingate', 'confinement', 'veran', 'castex', 'covid19', 'gouvernement', 'trump', 'usacapitol']",[],518711111,518711111,humaindesouche,The Last Boy Scout 🕊🇫🇷🇪🇺🇩🇿🕌 🕍 💒,3,23,https://twitter.com/humaindesouche/status/1346969751285886978,[],['https://pbs.twimg.com/tweet_video_thumb/ErFl2FUW4AAacl7.jpg'],1,https://pbs.twimg.com/tweet_video_thumb/ErFl2FUW4AAacl7.jpg,False,0,0,1,,Trump,,,,,,,[],,,,
715,1346969751227047937,1346969751227047937,1609977588000.0,2021-01-06 23:59:48,+0100,,i am incredibly frustrated and at a loss for words right now. these pro trump rioters should be receiving the same treatment that the black lives matter protesters did back in june. it’s so sick and twisted. this country is a fucking joke.,en,[],[],1315745298497507328,1315745298497507328,amanduhhhrae,amanda rae,3,23,https://twitter.com/amanduhhhrae/status/1346969751227047937,[],[],0,,False,13,0,4,,Trump,,,,,,,[],,,,
716,1346969751206166530,1346969751206166530,1609977588000.0,2021-01-06 23:59:48,+0100,,"I would like to see just done upon Trump like a terrible swift sword.  Metaphorically, I guess... But rapid, immediate, now.",en,[],[],268594010,268594010,lameone54,peter lahey,3,23,https://twitter.com/lameone54/status/1346969751206166530,[],[],0,,False,1,1,0,https://twitter.com/kylegriffin1/status/1346966212442423301,Trump,,,,,,,[],,,,
717,1346969751105331201,1346941848032477184,1609977588000.0,2021-01-06 23:59:48,+0100,,@Jeopardy408 Well don’t try texting your Republican trump supporting father and ask him if this was the straw bc apparently it wasn’t ????,en,[],[],365804555,365804555,LadySmallz,Stephy B 🏳‍🌈,3,23,https://twitter.com/LadySmallz/status/1346969751105331201,[],[],0,,False,0,0,0,,Trump,,,,,,,"[{'screen_name': 'Jeopardy408', 'name': 'jeopardizzle foshizzle \U0001f9cb', 'id': '1149119714'}]",,,,
718,1346969750899978240,1346969750899978240,1609977588000.0,2021-01-06 23:59:48,+0100,,Remember when Antifa and BLM violently stormed the Capitol?  I don’t either.  This is Trump’s America. And it was 100% foreseeable in 2016.,en,[],[],769960732104466432,769960732104466432,HenryRambow,Henry Rambow,3,23,https://twitter.com/HenryRambow/status/1346969750899978240,[],[],0,,False,51,1,8,,Trump,,,,,,,[],,,,
719,1346969750899892227,1346969750899892227,1609977588000.0,2021-01-06 23:59:48,+0100,,"These trump supporters getting out of hand, just take the loss and move on.",en,[],[],737595134,737595134,AmbitiousK__,KK.🌱,3,23,https://twitter.com/AmbitiousK__/status/1346969750899892227,[],[],0,,False,0,0,0,,Trump,,,,,,,[],,,,
720,1346969750832902144,1346966027884748802,1609977588000.0,2021-01-06 23:59:48,+0100,,@kare11 Donald J Trump is unfit for office. It is time for the 25th Amendment now!  https://t.co/j59l2yjajw,en,[],[],985667565392465921,985667565392465921,tinfoilted1,@tinfoilted,3,23,https://twitter.com/tinfoilted1/status/1346969750832902144,[],[],1,https://pbs.twimg.com/ext_tw_video_thumb/1224906195367907328/pu/img/i3FhSLT2dD1taFq2.jpg,False,1,0,0,,Trump,,,,,,,"[{'screen_name': 'kare11', 'name': 'KARE 11', 'id': '13001192'}]",,,,
721,1346969750790950915,1346969750790950915,1609977588000.0,2021-01-06 23:59:48,+0100,,"At least THREE law enforcement officers have been put in the hospital and ""Protestors"" are STILL defying their orders to obey the curfew. I thought Trump supporters respected the police? #FactsMatter #BlueLivesMatter #DomesticTerrorists #CoupAtTheCapitol #FBR #FBRParty #Resist",en,"['factsmatter', 'bluelivesmatter', 'domesticterrorists', 'coupatthecapitol', 'fbr', 'fbrparty', 'resist']",[],2359537176,2359537176,jayoung1892,Mighty Joe Young #Vaccinated,3,23,https://twitter.com/jayoung1892/status/1346969750790950915,[],[],0,,False,7,1,3,,Trump,,,,,,,[],,,,
722,1346969750769856516,1346954747996205062,1609977588000.0,2021-01-06 23:59:48,+0100,,"@KenPaxtonTX If it walks like a duck, quacks like a duck, and storms the capital building carrying a Trump 2020 flag...",en,[],[],2155856004,2155856004,RiverSong000,Jess,3,23,https://twitter.com/RiverSong000/status/1346969750769856516,[],[],0,,False,0,0,0,,Trump,,,,,,,"[{'screen_name': 'KenPaxtonTX', 'name': 'Attorney General Ken Paxton', 'id': '45840174'}]",,,,
723,1346969750673494016,1346969750673494016,1609977588000.0,2021-01-06 23:59:48,+0100,,"Ataşı harladım... Bunu bütün Eyaletlere yayacağım, bunu da böyle bilesiz..! 😂😂😂 #Trump #WashingtonDC #Biden #gösteri #ABD #USA  https://t.co/pbEbTdbMxu",tr,"['trump', 'washingtondc', 'biden', 'gösteri', 'abd', 'usa']",[],262322755,262322755,inciahmet,🇹🇷İnciBaba🇹🇷,3,23,https://twitter.com/inciahmet/status/1346969750673494016,[],['https://pbs.twimg.com/media/ErFlgNIUYAQqENM.jpg'],1,https://pbs.twimg.com/media/ErFlgNIUYAQqENM.jpg,False,35,0,9,,Trump,,,,,,,[],,,,
724,1346969750656614401,1346969750656614401,1609977588000.0,2021-01-06 23:59:48,+0100,,You know I won’t regularly do this because this isn’t what I’m here for but...  mannnn it’s hella sad when America 🇺🇸 is the laughing stock of the world because people are being ignorant as fuck. Idc at all but I hate trump and the way he divided our country. Now this shit.. smfh,en,[],[],3104293142,3104293142,badfox61,Steve I-Forgotti,3,23,https://twitter.com/badfox61/status/1346969750656614401,[],[],0,,False,5,2,0,,Trump,,,,,,,[],,,,
725,1346969750400733190,1346969750400733190,1609977588000.0,2021-01-06 23:59:48,+0100,,why is Trump allowed on Twitter? he has incited sedition and violence.,en,[],[],2808700942,2808700942,BoynDean,Boyn Dean,3,23,https://twitter.com/BoynDean/status/1346969750400733190,[],[],0,,False,0,0,0,,Trump,,,,,,,[],,,,
726,1346969750379896839,1346964816964046849,1609977588000.0,2021-01-06 23:59:48,+0100,,@SidneyPowell1 @michaeljohns @realMikeLindell @GoJackFlynn @LLinWood @TomFitton @PatrickByrne @SenRonJohnson @BarbaraRedgate @CarlosESilva65 @RichardGrenell They are meeting to remove Trump at this moment. They will reap what they sow.. Believe that this will come back to them in spades.,en,[],[],1342920922890706944,1342920922890706944,njmartiniii,JU JU,3,23,https://twitter.com/njmartiniii/status/1346969750379896839,[],[],0,,False,0,0,0,,Trump,,,,,,,"[{'screen_name': 'SidneyPowell1', 'name': 'Sidney Powell 🇺🇸⭐⭐⭐ #Kraken', 'id': '586707638'}, {'screen_name': 'michaeljohns', 'name': 'Michael Johns', 'id': '14828860'}, {'screen_name': 'realMikeLindell', 'name': 'Mike Lindell', 'id': '3047722897'}, {'screen_name': 'LLinWood', 'name': 'Lin Wood', 'id': '187680645'}, {'screen_name': 'TomFitton', 'name': 'Tom Fitton', 'id': '18266688'}, {'screen_name': 'PatrickByrne', 'name': 'Patrick Byrne', 'id': '1881296893'}, {'screen_name': 'SenRonJohnson', 'name': 'Senator Ron Johnson', 'id': '233737858'}, {'screen_name': 'CarlosESilva65', 'name': 'Carlos silva', 'id': '1322356650758541312'}, {'screen_name': 'RichardGrenell', 'name': 'Richard Grenell', 'id': '90480218'}]",,,,
727,1346969750379712512,1346969750379712512,1609977588000.0,2021-01-06 23:59:48,+0100,,"you laid down with the dog ""trump"" and now you all have fleas",en,[],[],1186978311496437760,1186978311496437760,Michell65089498,MMM,3,23,https://twitter.com/Michell65089498/status/1346969750379712512,[],[],0,,False,1,0,0,https://twitter.com/SenateGOP/status/1346928451681349635,Trump,,,,,,,[],,,,
728,1346969750371512321,1346969184387870720,1609977588000.0,2021-01-06 23:59:48,+0100,,"@CortesSteve Steve, you will forever be remembered for being a Trump enabler...Trump will go down in history as the worst president ever...",en,[],[],230517296,230517296,jeffgent99,jeff george,3,23,https://twitter.com/jeffgent99/status/1346969750371512321,[],[],0,,False,0,0,0,,Trump,,,,,,,"[{'screen_name': 'CortesSteve', 'name': 'Steve Cortes', 'id': '229141520'}]",,,,
729,1346969750325219328,1346969750325219328,1609977588000.0,2021-01-06 23:59:48,+0100,,Donald Trump posts utterly deranged video about U.S. Capitol attack  https://t.co/WEDbHZWP6E via @PalmerReport,en,[],[],39856233,39856233,CheesecakeNana,Bonnie Harris,3,23,https://twitter.com/CheesecakeNana/status/1346969750325219328,['https://www.palmerreport.com/analysis/video-about-u-s-capitol-attack/35266'],[],0,,False,0,0,0,,Trump,,,,,,,[],,,,
730,1346969750270660609,1346969750270660609,1609977588000.0,2021-01-06 23:59:48,+0100,,Chequen mi canal de twitch #trend #Trump #streaming #STREAM  https://t.co/sB53DlUVC4,es,"['trend', 'trump', 'streaming', 'stream']",[],995772982529159168,995772982529159168,RjRene98,René,3,23,https://twitter.com/RjRene98/status/1346969750270660609,['https://m.twitch.tv/apolowid'],[],0,,False,1,0,0,,Trump,,,,,,,[],,,,
731,1346969750224695302,1346969750224695302,1609977588000.0,2021-01-06 23:59:48,+0100,,"Knowing that the ones that break through the Congress with the help of the Washington police were dems/Antifa rioters is a confirmation of Trump's victory, but listen Biden claiming for peace accusing the president is really awkward and out of context.",en,[],[],1966124636,1966124636,DualbertoBrito,Dualberto Brito #ProLife #WeAreTrump,3,23,https://twitter.com/DualbertoBrito/status/1346969750224695302,[],[],0,,False,0,0,0,https://twitter.com/DualbertoBrito/status/1346967017614663680,Trump,,,,,,,[],,,,
732,1346969750220406788,1346969750220406788,1609977588000.0,2021-01-06 23:59:48,+0100,,Watch Live: Trump tries to justify chaos at Capitol  https://t.co/xQ8bC4fG9G,en,[],[],20572543,20572543,BoneKnightmare,#TheResistance,3,23,https://twitter.com/BoneKnightmare/status/1346969750220406788,['http://ow.ly/yocT30rrAw2'],[],0,,False,0,0,0,,Trump,,,,,,,[],,,,
733,1346969750178582528,1346968778798727173,1609977588000.0,2021-01-06 23:59:48,+0100,,"@mmpadellan Not rioters, BUT DOMESTIC TERRORIST! Trump is their leader.",en,[],[],1304473358839488513,1304473358839488513,Dee74157510,Starr,3,23,https://twitter.com/Dee74157510/status/1346969750178582528,[],[],0,,False,0,0,1,,Trump,,,,,,,"[{'screen_name': 'mmpadellan', 'name': 'BrooklynDad_Defiant!', 'id': '1640929196'}]",,,,
734,1346969750165987332,1346918219991420928,1609977588000.0,2021-01-06 23:59:48,+0100,,@Mike_Pence Little too late Pence- you’ve been accomplice to this by not holding trump at bay... crocodile tears #crocodiletears  #TRAITORCRUZ #traitorholy,en,"['crocodiletears', 'traitorcruz', 'traitorholy']",[],824248357032001540,824248357032001540,romangirl56,romangirl,3,23,https://twitter.com/romangirl56/status/1346969750165987332,[],[],0,,False,0,0,0,,Trump,,,,,,,"[{'screen_name': 'Mike_Pence', 'name': 'Mike Pence', 'id': '22203756'}]",,,,
735,1346969750052556805,1346969750052556805,1609977588000.0,2021-01-06 23:59:48,+0100,,"twitter, trump'ın yetkilerini elinden almış.",tr,[],[],179489676,179489676,zagorel,Özgür Hakan Aslan,3,23,https://twitter.com/zagorel/status/1346969750052556805,[],[],0,,False,0,0,0,,Trump,,,,,,,[],,,,
736,1346969749989826560,1346888500021518343,1609977588000.0,2021-01-06 23:59:48,+0100,,@NBCNews @PeteWilliamsNBC Trump is responsible! He should be not in the office for rest of the weeks!,en,[],[],1262166986043412483,1262166986043412483,GirishK20208785,Girish Kothari,3,23,https://twitter.com/GirishK20208785/status/1346969749989826560,[],[],0,,False,0,0,0,,Trump,,,,,,,"[{'screen_name': 'NBCNews', 'name': 'NBC News', 'id': '14173315'}, {'screen_name': 'PeteWilliamsNBC', 'name': 'Pete Williams', 'id': '615443591'}]",,,,
737,1346969749922701313,1346969749922701313,1609977588000.0,2021-01-06 23:59:48,+0100,,"""Trump tiene la habilidad de transmitir al mundo la imagen tópica de EEUU que vemos en las películas"", dice el corresponsal @sandro_pozzi No hay más que ver estas escenas del asalto al Capitolio... This is Hollywood.  https://t.co/i9rC59zaag",es,[],[],339120684,339120684,jcelmundo,JuanCarlos Rodríguez,3,23,https://twitter.com/jcelmundo/status/1346969749922701313,[],"['https://pbs.twimg.com/media/ErFl2DaXUAI0VBN.jpg', 'https://pbs.twimg.com/media/ErFl2RhWMAc-yOs.jpg']",1,https://pbs.twimg.com/media/ErFl2DaXUAI0VBN.jpg,False,1,0,1,,Trump,,,,,,,[],,,,
738,1346969749872373761,1344300908256104450,1609977588000.0,2021-01-06 23:59:48,+0100,,"@UnleadedType @RepMullin Ok sheeple, 50+ court cases rejected (SCOTUS x2) &amp; AG Barr said there was no widespread fraud. Pennsylvania only found 3 cases, all for Trump by the way. The DHS Cybersecurity Director was fired because he said it was the safest election ever. What more proof do you need?",en,[],[],577253030,577253030,chrisandhang,Chris,3,23,https://twitter.com/chrisandhang/status/1346969749872373761,[],[],0,,False,0,0,0,,Trump,,,,,,,"[{'screen_name': 'UnleadedType', 'name': 'UnleadedType', 'id': '2360604661'}, {'screen_name': 'RepMullin', 'name': 'Markwayne Mullin', 'id': '1060370282'}]",,,,
739,1346969749847113728,1346956951708520454,1609977588000.0,2021-01-06 23:59:48,+0100,,"@gnfobic If they are attacking POC, it's not the Proud Boys. Do you even know who they are? Have you been to their website? It could be ANTIFA impersonating the Proud Boys just like they were impersonating Trump supporters in D.C.",en,[],[],1326533780,1326533780,MythKitty7,Sasha,3,23,https://twitter.com/MythKitty7/status/1346969749847113728,[],[],0,,False,2,1,0,,Trump,,,,,,,[],,,,
740,1346969749838696449,1346923312857796612,1609977588000.0,2021-01-06 23:59:48,+0100,,"@SpeakerPelosi @SenSchumer Hey Nancy. I trust that you know what you’re doing. However going back to the capitol tonight after a woman was shot outside the chambers may come off a tad bit insensitive. I know we want to get it done, but how is that going to play? Let trump being AWOL be the story tonight!",en,[],[],1032133147348148224,1032133147348148224,TrumpShtShow1,Trump Sh*t Show,3,23,https://twitter.com/TrumpShtShow1/status/1346969749838696449,[],[],0,,False,0,0,0,,Trump,,,,,,,"[{'screen_name': 'SpeakerPelosi', 'name': 'Nancy Pelosi', 'id': '15764644'}, {'screen_name': 'SenSchumer', 'name': 'Chuck Schumer', 'id': '17494010'}]",,,,
741,1346969749805264899,1346968874013646848,1609977588000.0,2021-01-06 23:59:48,+0100,,@NoahJ456 I like trump but you still are my favorite noah keep it up,en,[],[],1196969394376781825,1196969394376781825,Igor60167634,Igor,3,23,https://twitter.com/Igor60167634/status/1346969749805264899,[],[],0,,False,5,3,0,,Trump,,,,,,,"[{'screen_name': 'NoahJ456', 'name': 'NoahJ456', 'id': '352881953'}]",,,,
742,1346969749570260993,1346969749570260993,1609977588000.0,2021-01-06 23:59:48,+0100,,"📬 I delivered “Donald Trump” from Eric, a constituent in Wichita, Kan., to @RepRonEstes, @JerryMoran and @RepMarshall #KS04 #KSpolitics #KSpol #KSpoli  📝 Write your own:  https://t.co/z5540KFSKD  https://t.co/d6vVVJZGFz",en,"['ks04', 'kspolitics', 'kspol', 'kspoli']",[],938533034659168256,938533034659168256,openletterbot,Open Letters,3,23,https://twitter.com/openletterbot/status/1346969749570260993,['https://twitter.com/messages/compose?recipient_id=835740314006511618&text=resist'],['https://pbs.twimg.com/media/ErFl2RGVQAE5ThR.jpg'],1,https://pbs.twimg.com/media/ErFl2RGVQAE5ThR.jpg,False,2,0,0,,Trump,,,,,,,[],,,,
743,1346969749549273095,1346954176480251905,1609977588000.0,2021-01-06 23:59:48,+0100,,"@ROYA__Ro @Know_More_News been wondering the same thing for a while.  The whole thing reminded me of the ""you're fired"" series staring ,,,who else,,,Trump",en,[],[],901195591945826304,901195591945826304,WhimsyQuest,WhimsyQuest,3,23,https://twitter.com/WhimsyQuest/status/1346969749549273095,[],[],0,,False,1,0,0,,Trump,,,,,,,"[{'screen_name': 'ROYA__Ro', 'name': 'ROYA💧 color me corona #quarantine+vaccine 4 ever?', 'id': '1005670399676436480'}, {'screen_name': 'Know_More_News', 'name': 'Know More News 🛡️', 'id': '3214466631'}]",,,,
744,1346969749326950400,1346941164377829383,1609977588000.0,2021-01-06 23:59:48,+0100,,"@kasleuk @JoyceDFoto das ""q anon sent me"" schild wurde rausgeschnitten um genau so idioten wie dich mit fake news zu catchen. der typ hat sogar interviews gegeben wo er darüber redet was er and den trump demos so nice findet. raff dich kratz dich",de,[],[],3361033558,3361033558,ff15xD,WuW,3,23,https://twitter.com/ff15xD/status/1346969749326950400,[],[],0,,False,1,0,0,,Trump,,,,,,,"[{'screen_name': 'kasleuk', 'name': 'Henry - alias Robin - Merry Men', 'id': '767467470'}, {'screen_name': 'JoyceDFoto', 'name': 'Joyce Derksen Fotografie 📸🖼️', 'id': '1288473505'}]",,,,
745,1346969749306093570,1346906603006681088,1609977588000.0,2021-01-06 23:59:48,+0100,,"@kylenabecker Not by any Patriot Trump Supporter..!  No Fires, No Burning of Police Cars - and No Person was shot by any Patriot Trump Supporter (Unlike BLM and Antifa)  https://t.co/zEboaylFiS",en,[],[],1151605848109670400,1151605848109670400,RicardosTravels,Ricardos Travels,3,23,https://twitter.com/RicardosTravels/status/1346969749306093570,[],"['https://pbs.twimg.com/media/ErFlVhwVkAIuvhG.jpg', 'https://pbs.twimg.com/media/ErFlViLUcAI1uSv.jpg']",1,https://pbs.twimg.com/media/ErFlVhwVkAIuvhG.jpg,False,0,0,0,,Trump,,,,,,,"[{'screen_name': 'kylenabecker', 'name': 'Kyle Becker', 'id': '321954654'}]",,,,
746,1346969749285179395,1346969749285179395,1609977588000.0,2021-01-06 23:59:48,+0100,,"Trump should be removed from office to preserve democracy, business leaders say – CNN  https://t.co/AybETmoxeq",en,[],[],3549429319,3549429319,k29664911,Today's news summary,3,23,https://twitter.com/k29664911/status/1346969749285179395,['https://www.latesttoday.news/2021/01/06/u-s/trump-should-be-removed-from-office-to-preserve-democracy-business-leaders-say-cnn/'],[],0,,False,0,0,0,,Trump,,,,,,,[],,,,
747,1346969749171953666,1346969749171953666,1609977588000.0,2021-01-06 23:59:48,+0100,,Mitt Romney blames Trump as his supporters storm the US Capitol – Salt Lake Tribune  https://t.co/7hxPjjTRre,en,[],[],3549429319,3549429319,k29664911,Today's news summary,3,23,https://twitter.com/k29664911/status/1346969749171953666,['https://www.latesttoday.news/2021/01/06/u-s/mitt-romney-blames-trump-as-his-supporters-storm-the-us-capitol-salt-lake-tribune/'],[],0,,False,0,0,0,,Trump,,,,,,,[],,,,
748,1346969748739944449,1346918219991420928,1609977588000.0,2021-01-06 23:59:48,+0100,,@Mike_Pence Good then look at Trump and arrest him of incite a riot at the minimum for his speech right before they stormed capital hill.,en,[],[],774947791449812992,774947791449812992,Wonderbreadx835,zebnewton,3,23,https://twitter.com/Wonderbreadx835/status/1346969748739944449,[],[],0,,False,0,0,0,,Trump,,,,,,,"[{'screen_name': 'Mike_Pence', 'name': 'Mike Pence', 'id': '22203756'}]",,,,
749,1346969748702187521,1346969748702187521,1609977588000.0,2021-01-06 23:59:48,+0100,,@SenatorCollins I’m sorry. What was it you said about Trump learning his lesson by being impeached?,en,[],[],188987616,188987616,mapjresq,Michael A. Pezza Jr.,3,23,https://twitter.com/mapjresq/status/1346969748702187521,[],[],0,,False,0,0,0,,Trump,,,,,,,[],,,,
750,1346969748660133888,1346966979723157504,1609977588000.0,2021-01-06 23:59:48,+0100,,@ddale8 They really should just shut Trump down.,en,[],[],55417530,55417530,MaybeImALeo,The Sage Grouse: Uno dose…,3,23,https://twitter.com/MaybeImALeo/status/1346969748660133888,[],[],0,,False,2,0,1,,Trump,,,,,,,"[{'screen_name': 'ddale8', 'name': 'Daniel Dale', 'id': '225265639'}]",,,,
751,1346969748656033795,1346969748656033795,1609977588000.0,2021-01-06 23:59:48,+0100,,Jokes on the Trump terrorists because the revolution will not be televised,en,[],[],820774278,820774278,obiwanjacobiii,General Jacobi,3,23,https://twitter.com/obiwanjacobiii/status/1346969748656033795,[],[],0,,False,0,0,0,,Trump,,,,,,,[],,,,
752,1346969748509249537,1346969748509249537,1609977588000.0,2021-01-06 23:59:48,+0100,,Quindi adesso #Trump andrà dalla D' Urso?  #impeachment #WashingtonDC #CapitolHill #Mentana #CapitalHill #TrumpIsACriminal,it,"['trump', 'impeachment', 'washingtondc', 'capitolhill', 'mentana', 'capitalhill', 'trumpisacriminal']",[],3979830562,3979830562,LeoDeLeoDeLeoDe,Leo,3,23,https://twitter.com/LeoDeLeoDeLeoDe/status/1346969748509249537,[],[],0,,False,0,0,0,,Trump,,,,,,,[],,,,
753,1346969748458803202,1346968408294903810,1609977588000.0,2021-01-06 23:59:48,+0100,,@SethAbramson Only 13 arrests? 13????   What are the police doing?  Working with the Trump Mob?,en,[],[],16699493,16699493,julesman,jules,3,23,https://twitter.com/julesman/status/1346969748458803202,[],[],0,,False,1,1,1,,Trump,,,,,,,"[{'screen_name': 'SethAbramson', 'name': 'Seth Abramson', 'id': '3223426134'}]",,,,
754,1346969748412583936,1346968514742136838,1609977588000.0,2021-01-06 23:59:48,+0100,,@Trump_Fact_News mais alors du coup les pro Trump et Trump aident en réalité à accélérer la certification de Biden? Du coup Trump roule pour le Deep State?,fr,[],[],1335011221838450698,1335011221838450698,Rabbith16789595,Rabbit hole,3,23,https://twitter.com/Rabbith16789595/status/1346969748412583936,[],[],0,,False,3,0,0,,Trump,,,,,,,"[{'screen_name': 'Trump_Fact_News', 'name': 'Trump Fact news 🇺🇸', 'id': '4846658542'}]",,,,
755,1346969748286816259,1346939947249328129,1609977588000.0,2021-01-06 23:59:48,+0100,,@MeidasTouch Trump fanatics armed to the teeth with flags flying from their pickup trucks are not far removed from Isis Soldiers.,en,[],[],300002819,300002819,ACREGC9,Michael Doyle,3,23,https://twitter.com/ACREGC9/status/1346969748286816259,[],[],0,,False,0,0,0,,Trump,,,,,,,"[{'screen_name': 'MeidasTouch', 'name': 'MeidasTouch.com', 'id': '1243560408025198593'}]",,,,
