,id,conversation_id,created_at,date,timezone,place,tweet,language,hashtags,cashtags,user_id,user_id_str,username,name,day,hour,link,urls,photos,video,thumbnail,retweet,nlikes,nreplies,nretweets,quote_url,search,near,geo,source,user_rt_id,user_rt,retweet_id,reply_to,retweet_date,translate,trans_src,trans_dest
496,1346969766561521665,1346930516662972416,1609977592000.0,2021-01-06 23:59:52,+0100,,@SecretaryCarson Do some research.  This wasn't Trump people. This is Antifa.,en,[],[],597486555,597486555,em4est,American Patriot,3,23,https://twitter.com/em4est/status/1346969766561521665,[],[],0,,False,0,0,0,,Trump,,,,,,,"[{'screen_name': 'SecretaryCarson', 'name': 'Archive: Ben Carson', 'id': '828613457020870657'}]",,,,
497,1346969766561345536,1346955406699098114,1609977592000.0,2021-01-06 23:59:52,+0100,,"@JaredStubbs @GMA It has been investigated, recounted, and a drain on the entire nation. There has been no evidence of fraud. The allegations have been dismissed even by Trump-appointed judges. Do you really believe that Donald Trump—Donald Trump??!!—is the only person telling you the truth?",en,[],[],1317170917487693824,1317170917487693824,Anhedonia1967,Anhedonia,3,23,https://twitter.com/Anhedonia1967/status/1346969766561345536,[],[],0,,False,0,0,0,,Trump,,,,,,,"[{'screen_name': 'GMA', 'name': 'Good Morning America', 'id': '22650211'}]",,,,
498,1346969766540537859,1346969766540537859,1609977592000.0,2021-01-06 23:59:52,+0100,,Los agitadores de Trump no van vestidos para la revolución sino para la Comic Con.,es,[],[],13312212,13312212,PalomaLLaneza,Paloma LLaneza 👁,3,23,https://twitter.com/PalomaLLaneza/status/1346969766540537859,[],[],0,,False,3,0,1,https://twitter.com/medusadollmaker/status/1346947523806547976,Trump,,,,,,,[],,,,
499,1346969766536339458,1346967197030240259,1609977592000.0,2021-01-06 23:59:52,+0100,,@BernardKerik @LaughingMan5150 This has already been debunked. He is a Trump supporter.,en,[],[],1103281654766989312,1103281654766989312,AnimeWoodsLife,⭕K?What'sYourPoint?,3,23,https://twitter.com/AnimeWoodsLife/status/1346969766536339458,[],[],0,,False,0,0,0,,Trump,,,,,,,"[{'screen_name': 'BernardKerik', 'name': 'Bernard B. Kerik', 'id': '25837289'}, {'screen_name': 'LaughingMan5150', 'name': 'The Laughing Man', 'id': '3431742261'}]",,,,
500,1346969766532145155,1346949837384785921,1609977592000.0,2021-01-06 23:59:52,+0100,,@WBZNightside @LightningMarita Are you sure it’s Trump supporters?,en,[],[],3400091997,3400091997,jgabrielma4,John Gabriel,3,23,https://twitter.com/jgabrielma4/status/1346969766532145155,[],[],0,,False,2,1,0,,Trump,,,,,,,"[{'screen_name': 'WBZNightside', 'name': 'Dan Rea', 'id': '46218350'}, {'screen_name': 'LightningMarita', 'name': 'Producer Lightning', 'id': '978997140'}]",,,,
501,1346969766477627392,1346969766477627392,1609977592000.0,2021-01-06 23:59:52,+0100,,donald trump is a terrorist leader,en,[],[],41747023,41747023,MichaelShry,Michael Shry 🤠,3,23,https://twitter.com/MichaelShry/status/1346969766477627392,[],[],0,,False,1,0,0,,Trump,,,,,,,[],,,,
502,1346969766372642817,1346958222595264512,1609977592000.0,2021-01-06 23:59:52,+0100,,"@JaqenHg66366367 That’s exactly it! Greed is taking over and leaving all us poor people in the gutter! Only one who has went into power and lost money is Trump! The rest all take, take, take xxx",en,[],[],60048423,60048423,robz26,Robyn 🌸,3,23,https://twitter.com/robz26/status/1346969766372642817,[],[],0,,False,0,0,0,,Trump,,,,,,,"[{'screen_name': 'JaqenHg66366367', 'name': '😃🇬🇧General Whataboutery®🇬🇧😃', 'id': '1182114014870036480'}]",,,,
503,1346969766360178688,1346950275332927490,1609977592000.0,2021-01-06 23:59:52,+0100,,@marklevinshow They should be blaming you!  YOU are one of the main liars and inciters of violence. You just lied to your audience Trump did not call in the national guard. It was Pence!,en,[],[],712756271749791744,712756271749791744,Feliciatweet893,Felicia,3,23,https://twitter.com/Feliciatweet893/status/1346969766360178688,[],[],0,,False,0,0,0,,Trump,,,,,,,"[{'screen_name': 'marklevinshow', 'name': 'Mark R. Levin', 'id': '38495835'}]",,,,
504,1346969766213390337,1346946391394947078,1609977592000.0,2021-01-06 23:59:52,+0100,,"@JoJorgensenBros ""In 2017, Trump became the first billionaire in history to move into tax payer funded public housing previously occupied by a black man.""",en,[],[],911300550234275840,911300550234275840,thats_bonerific,Bonerific,3,23,https://twitter.com/thats_bonerific/status/1346969766213390337,[],[],0,,False,0,0,0,,Trump,,,,,,,"[{'screen_name': 'JoJorgensenBros', 'name': 'iWorkForTheState', 'id': '1275994054795366400'}]",,,,
505,1346969766188228608,1346969766188228608,1609977592000.0,2021-01-06 23:59:52,+0100,,"Aún queda mucho por hacer , Trump is the President!!!  https://t.co/yco1SNgIFc",es,[],[],1334695298703241218,1334695298703241218,Mayitosenalley2,MayitoSenalle,3,23,https://twitter.com/Mayitosenalley2/status/1346969766188228608,[],['https://pbs.twimg.com/media/ErFl3PMXAAETBKq.jpg'],1,https://pbs.twimg.com/media/ErFl3PMXAAETBKq.jpg,False,1,0,0,,Trump,,,,,,,[],,,,
506,1346969766079180801,1346969766079180801,1609977592000.0,2021-01-06 23:59:52,+0100,,BLes Mundo hace 3 horas 📢 ACTUALIZACIÓN: Mike Pence dejó de seguir a Trump en twitter...  ¿Alguna duda?,es,[],[],1251347940205113346,1251347940205113346,Masterl16918040,Masterlike,3,23,https://twitter.com/Masterl16918040/status/1346969766079180801,[],[],0,,False,0,0,0,,Trump,,,,,,,[],,,,
507,1346969765995114500,1346939618596368386,1609977592000.0,2021-01-06 23:59:52,+0100,,@RepJohnJoyce @RepJohnJoyce This is your 🤡 show. A political stunt that has one person dead. You have blood in your hands. You being disgrace to all Pennsylvanians and The United States of America. You didn't say one one of Trump for inciting this violence or of the dead woman. #Haveyounosoul,en,['haveyounosoul'],[],3433428365,3433428365,jfwhyte,Ben Franlin is a Friend of mine,3,23,https://twitter.com/jfwhyte/status/1346969765995114500,[],[],0,,False,2,0,0,,Trump,,,,,,,"[{'screen_name': 'RepJohnJoyce', 'name': 'John Joyce', 'id': '1082311988926124036'}]",,,,
508,1346969765990944772,1346912122182135811,1609977592000.0,2021-01-06 23:59:52,+0100,,@ChadHastyRadio Trump supporters = Trump enablers.  All gave this monster oxygen.  All are guilty by association.,en,[],[],53123820,53123820,LCox_Eugene,LCox 🏴‍☠️🇺🇸,3,23,https://twitter.com/LCox_Eugene/status/1346969765990944772,[],[],0,,False,1,0,0,,Trump,,,,,,,"[{'screen_name': 'ChadHastyRadio', 'name': 'Chad Hasty', 'id': '14927208'}]",,,,
509,1346969765882028032,1346955951279058949,1609977592000.0,2021-01-06 23:59:52,+0100,,"@LeslieMarshall @Johnny_Joey Same height, same beard, same everything. Not a Trump supporter. Take care of my home state and stay healthy.",en,[],[],472392172,472392172,TimsunTim,Dr. Tim Chastain,3,23,https://twitter.com/TimsunTim/status/1346969765882028032,[],[],0,,False,0,0,0,,Trump,,,,,,,"[{'screen_name': 'LeslieMarshall', 'name': 'Leslie Marshall', 'id': '26350255'}, {'screen_name': 'Johnny_Joey', 'name': 'Joey Jones', 'id': '381678556'}]",,,,
510,1346969765840113668,1346957936296398855,1609977592000.0,2021-01-06 23:59:52,+0100,,"@JooJooEyeBall7 @dakminn @ResisterSis20 not rubber, real bullets would’ve rained down and there’d been casualties justified by trump but nothing to see or prosecute here, just some very fine people. are we going to let this par his base do this and walk free? What’s to deter the next event? it is terrorism",en,[],[],3167305575,3167305575,FatherOfZeusers,Welcome to SDNY “Mr Trump”,3,23,https://twitter.com/FatherOfZeusers/status/1346969765840113668,[],[],0,,False,0,0,1,,Trump,,,,,,,"[{'screen_name': 'JooJooEyeBall7', 'name': 'Jillian Kate 🌊🌊🌊', 'id': '49357411'}, {'screen_name': 'dakminn', 'name': 'Rosie Wild', 'id': '60744969'}, {'screen_name': 'ResisterSis20', 'name': 'Southern Sister Resister - Wordsmith #IAmTheStorm', 'id': '328756439'}]",,,,
511,1346969765819019266,1346969765819019266,1609977592000.0,2021-01-06 23:59:52,+0100,,"Hmmmm...I just wonder how many Democrats, ANTIFA, etc. infiltrated the rally posing as Trump supporters to raise havoc so people think it was the Republicans? Not saying they have or haven’t, and won’t be responding to comments. Just food for thought.",en,[],[],1733497310,1733497310,memayhue,Mark M,3,23,https://twitter.com/memayhue/status/1346969765819019266,[],[],0,,False,0,0,0,,Trump,,,,,,,[],,,,
512,1346969765785468930,1346969765785468930,1609977592000.0,2021-01-06 23:59:52,+0100,,Hey Mr. Trump: All options are on the table.,en,[],[],138038293,138038293,ManuelDelborneo,Manuel Delborne0,3,23,https://twitter.com/ManuelDelborneo/status/1346969765785468930,[],[],0,,False,0,0,0,,Trump,,,,,,,[],,,,
513,1346969765542301697,1346897398984024065,1609977592000.0,2021-01-06 23:59:52,+0100,,@senatemajldr Your shameful behavior created the Trump monster. A woman is dead. Her blood is on your hands.  https://t.co/DohdcHdU3a,en,[],[],1323487763619041280,1323487763619041280,19ckwk56,cindykwk,3,23,https://twitter.com/19ckwk56/status/1346969765542301697,[],['https://pbs.twimg.com/tweet_video_thumb/ErFl3CvXYAAYeGj.jpg'],1,https://pbs.twimg.com/tweet_video_thumb/ErFl3CvXYAAYeGj.jpg,False,0,0,0,,Trump,,,,,,,[],,,,
514,1346969765491863552,1345757410489724930,1609977592000.0,2021-01-06 23:59:52,+0100,,"@ApeironKnight @DailyGrifter Nick failed us, No ten minute T pose = No Trump win",en,[],[],1033148935764766720,1033148935764766720,TrotGang,Ethan,3,23,https://twitter.com/TrotGang/status/1346969765491863552,[],[],0,,False,0,0,0,,Trump,,,,,,,"[{'screen_name': 'ApeironKnight', 'name': 'Apeiron', 'id': '1219697970850955264'}, {'screen_name': 'DailyGrifter', 'name': 'The Daily Grifter', 'id': '702713126483984385'}]",,,,
515,1346969765470879750,1346969184387870720,1609977592000.0,2021-01-06 23:59:52,+0100,,"@CortesSteve Cool story, bro. And Trump taught us its OK to interfere with investigations so good luck with that.",en,[],[],208056062,208056062,Cr8z13,Cr8z13,3,23,https://twitter.com/Cr8z13/status/1346969765470879750,[],[],0,,False,2,1,0,,Trump,,,,,,,"[{'screen_name': 'CortesSteve', 'name': 'Steve Cortes', 'id': '229141520'}]",,,,
516,1346969765412286470,1346969765412286470,1609977592000.0,2021-01-06 23:59:52,+0100,,Senador republicano que alza la voz para señalar a #Trump y responsabilizarlo de lo ocurrido. #EEUU,es,"['trump', 'eeuu']",[],276005081,276005081,_jesusespinosa_,Jesús Espinosa,3,23,https://twitter.com/_jesusespinosa_/status/1346969765412286470,[],[],0,,False,2,0,0,https://twitter.com/dnvolz/status/1346968321124675585,Trump,,,,,,,[],,,,
517,1346969765357654016,1346942792774381568,1609977592000.0,2021-01-06 23:59:52,+0100,,@eliehonig @drceecee IMPEACH AND REMOVE TRUMP NOW ENOUGH,en,[],[],831605450445451265,831605450445451265,GaryMaryBennet1,Gary & Mary Bennett,3,23,https://twitter.com/GaryMaryBennet1/status/1346969765357654016,[],[],0,,False,0,0,0,,Trump,,,,,,,"[{'screen_name': 'eliehonig', 'name': 'Elie Honig', 'id': '248429222'}, {'screen_name': 'drceecee', 'name': 'Cindy Lou Who', 'id': '240470639'}]",,,,
518,1346969765340983296,1346969765340983296,1609977592000.0,2021-01-06 23:59:52,+0100,,"Quick question, what’s more plausible Trump is a a lying bitch ass criminal using the system to grift or Democrats have a sex ring  under pizza houses. Your answer was probably different 8 months ago. #ArrestTrump",en,['arresttrump'],[],1202017867891433473,1202017867891433473,SpeakNoles,Speak Truth To Power Noles,3,23,https://twitter.com/SpeakNoles/status/1346969765340983296,[],[],0,,False,0,0,0,,Trump,,,,,,,[],,,,
519,1346969765282074625,1346930693880901634,1609977592000.0,2021-01-06 23:59:52,+0100,,@magnus_gao @onedarwinian @NatashaFatah Neither did Trump.,en,[],[],1127559598242537472,1127559598242537472,CueBall09749148,CueBall,3,23,https://twitter.com/CueBall09749148/status/1346969765282074625,[],[],0,,False,0,1,0,,Trump,,,,,,,"[{'screen_name': 'onedarwinian', 'name': 'Mark Scott', 'id': '2726767198'}, {'screen_name': 'NatashaFatah', 'name': 'Natasha Fatah', 'id': '14691203'}]",,,,
520,1346969765068333058,1346967154336403458,1609977592000.0,2021-01-06 23:59:52,+0100,,"@NassiraELM @pascalriche C'est Trump qui parle d'attentat contre la démocratie !  relis bien le Tweet : "" ... le post de Trump où ce dernier revendiquait l'attentat contre la démocratie …""",fr,[],[],882359155,882359155,mohsan_75,Mohsan_75,3,23,https://twitter.com/mohsan_75/status/1346969765068333058,[],[],0,,False,0,1,0,,Trump,,,,,,,"[{'screen_name': 'NassiraELM', 'name': 'Nassira El Moaddem', 'id': '19990293'}, {'screen_name': 'pascalriche', 'name': 'Pascal Riché', 'id': '31159552'}]",,,,
521,1346969764946714627,1346969764946714627,1609977592000.0,2021-01-06 23:59:52,+0100,,Religion AND Trump must go!!!!!!,en,[],[],2307254556,2307254556,FaatimahAnaksun,THE GODDESS.... forreal!,3,23,https://twitter.com/FaatimahAnaksun/status/1346969764946714627,[],[],0,,False,0,0,0,,Trump,,,,,,,[],,,,
522,1346969764892090368,1346969764892090368,1609977592000.0,2021-01-06 23:59:52,+0100,,Pelosi just before the Trump rally. “ Let them eat cake “ then the Queen ran from the building.,en,[],[],37572592,37572592,PrisonguardGino,Gino Whitehall,3,23,https://twitter.com/PrisonguardGino/status/1346969764892090368,[],[],0,,False,0,0,0,,Trump,,,,,,,[],,,,
523,1346969764795543553,1346963272600223746,1609977592000.0,2021-01-06 23:59:52,+0100,,"@sassycarrie He still didn't condemn trump though, his language is deliberate; enough to say that violence is wrong and keep him out of trouble but still not condemning his mate.",en,[],[],1207389541650202624,1207389541650202624,somewherein84,somewherein84,3,23,https://twitter.com/somewherein84/status/1346969764795543553,[],[],0,,False,6,2,0,,Trump,,,,,,,"[{'screen_name': 'sassycarrie', 'name': 'Sassy Carrie', 'id': '26685249'}]",,,,
524,1346969764632137728,1346969764632137728,1609977592000.0,2021-01-06 23:59:52,+0100,,Trump needs to be removed,en,[],[],1198722571723853828,1198722571723853828,NathanSoule5,NathanSoule5,3,23,https://twitter.com/NathanSoule5/status/1346969764632137728,[],[],0,,False,1,0,0,,Trump,,,,,,,[],,,,
525,1346969764623765505,1346969764623765505,1609977592000.0,2021-01-06 23:59:52,+0100,,"# Trump Insurrection- 25 th Amendment NOW! Remove him from the Oval Office, haul him out🤬",en,[],[],742119350555926528,742119350555926528,crendade,Carrie,3,23,https://twitter.com/crendade/status/1346969764623765505,[],[],0,,False,1,0,0,,Trump,,,,,,,[],,,,
526,1346969764619460608,1346945791303311360,1609977592000.0,2021-01-06 23:59:52,+0100,,@LindseyGrahamSC Start with Trump. And stop pretending you had nothing to do with this. You are complicit.  In your own words Trump has ruined our democracy and given us what we deserve.,en,[],[],1050876360892264449,1050876360892264449,andover_gary,Gary Andover,3,23,https://twitter.com/andover_gary/status/1346969764619460608,[],[],0,,False,8,0,1,,Trump,,,,,,,"[{'screen_name': 'LindseyGrahamSC', 'name': 'Lindsey Graham', 'id': '432895323'}]",,,,
527,1346969764405649410,1346969024253583360,1609977591000.0,2021-01-06 23:59:51,+0100,,Comparing Snyder fans to Trump supporters?   Pattern.,en,[],[],1261058948838289408,1261058948838289408,snyderhaters,ZSJL,3,23,https://twitter.com/snyderhaters/status/1346969764405649410,[],[],0,,False,35,2,1,,Trump,,,,,,,[],,,,
528,1346969764397199360,1346969764397199360,1609977591000.0,2021-01-06 23:59:51,+0100,,not my family members still sharing pro trump things on facebook,en,[],[],163348054,163348054,kinggoodies_,jordan 🏳️‍🌈,3,23,https://twitter.com/kinggoodies_/status/1346969764397199360,[],[],0,,False,32,2,0,,Trump,,,,,,,[],,,,
529,1346969764342730756,1346888500021518343,1609977591000.0,2021-01-06 23:59:51,+0100,,"@NBCNews @PeteWilliamsNBC I fixed it for u guys.  BREAKING: 1 TERRORIST was shot this afternoon inside the U.S. Capitol building by a member of law enforcement as Trump supporters stormed the building, several law enforcement officials say - @PeteWilliamsNBC  https://t.co/b8q6pbxLKp",en,[],[],2904020282,2904020282,LurkingZombie_,Albert #E32021 #HaloInfinite,3,23,https://twitter.com/LurkingZombie_/status/1346969764342730756,['https://www.nbcnews.com/politics/donald-trump/we-will-never-concede-trump-baselessly-asserts-voter-fraud-speech-n1253011'],[],0,,False,20,2,3,,Trump,,,,,,,"[{'screen_name': 'NBCNews', 'name': 'NBC News', 'id': '14173315'}, {'screen_name': 'PeteWilliamsNBC', 'name': 'Pete Williams', 'id': '615443591'}]",,,,
530,1346969764313239552,1346969764313239552,1609977591000.0,2021-01-06 23:59:51,+0100,,Qua in Italia vedremo qualcuna/o inginocchiarsi per la sostenitrice di #Trump rimasta uccisa? #CapitolHill #CasaBianca #Washington,it,"['trump', 'capitolhill', 'casabianca', 'washington']",[],1156123792986574850,1156123792986574850,Ilsuperbo89,Marco,3,23,https://twitter.com/Ilsuperbo89/status/1346969764313239552,[],[],0,,False,1,0,0,,Trump,,,,,,,[],,,,
531,1346969764216905729,1346969764216905729,1609977591000.0,2021-01-06 23:59:51,+0100,,"So let me get this straight.. Twitter removed the option to retweet or comment on 2 of Trump's tweets? So people can watch/read them, but no one can oppose them?",en,[],[],1418348534,1418348534,Fawnoftime,🌸 Melanie Fawn ✌🍁,3,23,https://twitter.com/Fawnoftime/status/1346969764216905729,[],[],0,,False,0,0,0,,Trump,,,,,,,[],,,,
532,1346969764212576256,1346968475151917056,1609977591000.0,2021-01-06 23:59:51,+0100,,@SabrinaSiddiqui @JessicaValenti The police are friends with the Trump Terrorists,en,[],[],809484055,809484055,AmericanWoman8,American Woman 💎,3,23,https://twitter.com/AmericanWoman8/status/1346969764212576256,[],[],0,,False,1,0,0,,Trump,,,,,,,"[{'screen_name': 'SabrinaSiddiqui', 'name': 'Sabrina Siddiqui', 'id': '27055034'}, {'screen_name': 'JessicaValenti', 'name': 'Jessica Valenti', 'id': '4099171'}]",,,,
533,1346969764179152898,1346969764179152898,1609977591000.0,2021-01-06 23:59:51,+0100,,"""Look at all those Trump supporters doing... stuff.""  https://t.co/lh0l62aiqj",en,[],[],270138786,270138786,soulnoidcrew,CaptSehanort,3,23,https://twitter.com/soulnoidcrew/status/1346969764179152898,[],['https://pbs.twimg.com/media/ErFlLUlXYAEbWDG.jpg'],1,https://pbs.twimg.com/media/ErFlLUlXYAEbWDG.jpg,False,0,0,0,,Trump,,,,,,,[],,,,
534,1346969764111986694,1346969764111986694,1609977591000.0,2021-01-06 23:59:51,+0100,,"Screen grab. Rioters replace the American flag with a Trump flag. As they cheer over their task, the American flag falls somberly to the ground.  https://t.co/F6KxlSJAeQ",en,[],[],2167570166,2167570166,ohgodshenandoah,S.R. Frederick,3,23,https://twitter.com/ohgodshenandoah/status/1346969764111986694,[],['https://pbs.twimg.com/media/ErFl3AtXIAAwTcq.jpg'],1,https://pbs.twimg.com/media/ErFl3AtXIAAwTcq.jpg,False,1,1,0,,Trump,,,,,,,[],,,,
535,1346969764036370432,1346969764036370432,1609977591000.0,2021-01-06 23:59:51,+0100,,"Trump  protesters surround Texas, California, Michigan, Georgia, Oregon AND Kansas state capitols  https://t.co/0lOefoxMT1 via @MailOnline",en,[],[],1027912178182041600,1027912178182041600,DrUSofA1,The Doctor Is In,3,23,https://twitter.com/DrUSofA1/status/1346969764036370432,['https://mol.im/a/9119837'],[],0,,False,0,0,0,,Trump,,,,,,,[],,,,
536,1346969764002811907,1346969764002811907,1609977591000.0,2021-01-06 23:59:51,+0100,,Trump better tweet as much as he can because once he’s no longer president his account is permanently banned as it should. Complete clown...,en,[],[],190573691,190573691,thearchetect,The Arch-E-Tect,3,23,https://twitter.com/thearchetect/status/1346969764002811907,[],[],0,,False,1,0,0,,Trump,,,,,,,[],,,,
537,1346969763956707328,1346952945103822848,1609977591000.0,2021-01-06 23:59:51,+0100,,"@CoryBMorgan BLM and Antifa riot, burn loot- Trumps fault.   Conservatives storm the capital- Trumps fault.   He should just actually walk away and sit back and witness the US destruction for the next 4 years.",en,[],[],1558110546,1558110546,kpac_15,Kevin Pac 15 🇨🇦🇮🇹🇬🇧,3,23,https://twitter.com/kpac_15/status/1346969763956707328,[],[],0,,False,11,3,2,,Trump,,,,,,,"[{'screen_name': 'CoryBMorgan', 'name': 'Cory Morgan', 'id': '253147396'}]",,,,
538,1346969763918925825,1346969763918925825,1609977591000.0,2021-01-06 23:59:51,+0100,,"Se reúne el congreso de EE.UU. para confirmar los resultados de las elecciones pasadas, Donald Trump estalla en twitter via @bitfinanzas  https://t.co/V0YdNNxQ1O",es,[],[],1293938234402250754,1293938234402250754,BitFinanzas,BitFinanzas,3,23,https://twitter.com/BitFinanzas/status/1346969763918925825,['https://bitfinanzas.com/se-reune-el-congreso-de-ee-uu-para-confirmar-los-resultados-de-las-elecciones-pasadas-donald-trump-estalla-en-twitter/'],[],0,,False,15,1,8,,Trump,,,,,,,[],,,,
539,1346969763835244544,1346964929719500801,1609977591000.0,2021-01-06 23:59:51,+0100,,@Leafer85 @Breaking911 Trump fans =Patriotic Americans Democrats =Brain dead communists,en,[],[],1068306441918955520,1068306441918955520,flagfriendly,JerseyBill,3,23,https://twitter.com/flagfriendly/status/1346969763835244544,[],[],0,,False,0,0,0,,Trump,,,,,,,"[{'screen_name': 'Breaking911', 'name': 'Breaking911', 'id': '375721095'}]",,,,
540,1346969763625504769,1346969763625504769,1609977591000.0,2021-01-06 23:59:51,+0100,,Trump will not get away with this one.he will be charge.,en,[],[],481858613,481858613,greene896,charles  greene,3,23,https://twitter.com/greene896/status/1346969763625504769,[],[],0,,False,6,0,1,,Trump,,,,,,,[],,,,
541,1346969763617021952,1346926138057220103,1609977591000.0,2021-01-06 23:59:51,+0100,,"@BorisJohnson Well then you to tell that to  your boy Trump,  this happen under him, cos he a white racist",en,[],[],1219372950215782400,1219372950215782400,naki_pete,Naki Pistol Pete,3,23,https://twitter.com/naki_pete/status/1346969763617021952,[],[],0,,False,0,0,0,,Trump,,,,,,,"[{'screen_name': 'BorisJohnson', 'name': 'Boris Johnson', 'id': '3131144855'}]",,,,
542,1346969763604529152,1346921903965970433,1609977591000.0,2021-01-06 23:59:51,+0100,,@chadfelixg The problem is that most of this is all about defending Trump the man. The good of our country barely factors in to his hard-core base.,en,[],[],792277274162671616,792277274162671616,SpillMyTincture,CynicalVampire,3,23,https://twitter.com/SpillMyTincture/status/1346969763604529152,[],[],0,,False,0,0,0,,Trump,,,,,,,"[{'screen_name': 'chadfelixg', 'name': 'Chad Felix Greene 🇮🇱', 'id': '17626317'}]",,,,
543,1346969763478724608,1346969763478724608,1609977591000.0,2021-01-06 23:59:51,+0100,,Righteous coming from a scumbag like you. What did Trump call your wife again? Go away ballsack.,en,[],[],2366322079,2366322079,Dc930Mike,Vaccinated Mike Clifford⚠️🇮🇪🇮🇩🏀🎸,3,23,https://twitter.com/Dc930Mike/status/1346969763478724608,[],[],0,,False,3,0,0,https://twitter.com/tedcruz/status/1346927158384414725,Trump,,,,,,,[],,,,
544,1346969763466121216,1346583537256976385,1609977591000.0,2021-01-06 23:59:51,+0100,,@realDonaldTrump @POTUS @DeptofDefense @TheJusticeDept @DHSgov @DHS_Wolf @SecBernhardt @SecretService @FBI Trump go away,en,[],[],1168488734200934401,1168488734200934401,SandraC15345423,Sandra Cornelius,3,23,https://twitter.com/SandraC15345423/status/1346969763466121216,[],[],0,,False,0,0,0,,Trump,,,,,,,"[{'screen_name': 'realDonaldTrump', 'name': 'Donald J. Trump', 'id': '25073877'}, {'screen_name': 'POTUS', 'name': 'President Biden', 'id': '1349149096909668363'}, {'screen_name': 'DeptofDefense', 'name': 'Department of Defense 🇺🇸', 'id': '66369181'}, {'screen_name': 'TheJusticeDept', 'name': 'Justice Department', 'id': '73181712'}, {'screen_name': 'DHSgov', 'name': 'Homeland Security', 'id': '15647676'}, {'screen_name': 'DHS_Wolf', 'name': 'Acting Secretary Chad Wolf', 'id': '1191733036133552128'}, {'screen_name': 'SecBernhardt', 'name': 'Secretary David Bernhardt', 'id': '821456935421693952'}, {'screen_name': 'SecretService', 'name': 'U.S. Secret Service', 'id': '115749048'}, {'screen_name': 'FBI', 'name': 'FBI', 'id': '17629860'}]",,,,
545,1346969763444969473,1346968581741928451,1609977591000.0,2021-01-06 23:59:51,+0100,,@AOC Glad to hear it queen. Now let’s impeach and remove Trump ASAP!!!,en,[],[],1122053233537454080,1122053233537454080,lucky1_en,Lucky One ♡/ 𝒯𝒶𝓎𝓁𝑜𝓇’𝓈 𝓋𝑒𝓇𝓈𝒾𝑜𝓃 ❤️❤️,3,23,https://twitter.com/lucky1_en/status/1346969763444969473,[],[],0,,False,2,0,0,,Trump,,,,,,,"[{'screen_name': 'AOC', 'name': 'Alexandria Ocasio-Cortez', 'id': '138203134'}]",,,,
546,1346969763440779267,1346969763440779267,1609977591000.0,2021-01-06 23:59:51,+0100,,"I know he only has to weeks left, but impeaching and convicting Trump should have happened long ago. Doing it despite the limited time frame may be key in salvaging what's left of democracy in the Trump era.",en,[],[],3250470126,3250470126,EnzoDeBorja,Enzo De Borja,3,23,https://twitter.com/EnzoDeBorja/status/1346969763440779267,[],[],0,,False,1,1,0,https://twitter.com/CNN/status/1346968045328224256,Trump,,,,,,,[],,,,
547,1346969763403059202,1346969763403059202,1609977591000.0,2021-01-06 23:59:51,+0100,,I'm sick of you uneducated dickheads thinking everyone that wear a uniform is a trump supporter.,en,[],[],3128135528,3128135528,1Mxnny,3MO,3,23,https://twitter.com/1Mxnny/status/1346969763403059202,[],[],0,,False,0,0,0,,Trump,,,,,,,[],,,,
548,1346969763399016454,1346968795131367427,1609977591000.0,2021-01-06 23:59:51,+0100,,"@DonnaWR8 He looks like a Nazi, so yes he's a Trump supporter",en,[],[],1181623057619804160,1181623057619804160,twacorbies749,twacorbies749,3,23,https://twitter.com/twacorbies749/status/1346969763399016454,[],[],0,,False,0,0,0,,Trump,,,,,,,"[{'screen_name': 'DonnaWR8', 'name': 'DONNA WARREN ⭐️🌟⭐️', 'id': '2922345639'}]",,,,
